{"type":"config","name":"Optimize syntax highlighting startup latency (3-run average)","metricName":"selected_highlight_ms","metricUnit":"ms","bestDirection":"lower"}
{"run":1,"commit":"0aa6ade","metric":1050.1,"metrics":{},"status":"keep","description":"benchmark: restore syntax startup autoresearch harness","timestamp":1773845062470,"segment":0}
{"run":2,"commit":"39e3284","metric":231.56,"metrics":{},"status":"keep","description":"perf: switch shared syntax startup to the Shiki wasm engine","timestamp":1773845153236,"segment":0}
{"run":3,"commit":"39e3284","metric":316.28,"metrics":{},"status":"discard","description":"perf: try two concurrent highlight renders with the wasm backend","timestamp":1773845178461,"segment":0}
{"run":4,"commit":"39e3284","metric":525.65,"metrics":{},"status":"discard","description":"perf: remove startup highlight queue with the wasm backend","timestamp":1773845216374,"segment":0}
{"run":5,"commit":"ab3f443","metric":153.37,"metrics":{},"status":"keep","description":"perf: prepare and render only the active syntax theme appearance","timestamp":1773845437833,"segment":0}
{"run":6,"commit":"3443377","metric":153.36,"metrics":{},"status":"keep","description":"perf: rely on Pierre shared highlighter state instead of a local prep cache","timestamp":1773845485578,"segment":0}
{"run":7,"commit":"3443377","metric":203.65,"metrics":{},"status":"discard","description":"perf: try two concurrent startup highlight renders after the appearance-specific change","timestamp":1773845516429,"segment":0}
{"run":8,"commit":"3443377","metric":305.71,"metrics":{},"status":"discard","description":"perf: remove startup highlight queue after the appearance-specific change","timestamp":1773845552726,"segment":0}
{"run":9,"commit":"3443377","metric":761.56,"metrics":{},"status":"discard","description":"perf: try the JavaScript Shiki engine after the appearance-specific change","timestamp":1773845592735,"segment":0}
{"run":10,"commit":"3443377","metric":299.8,"metrics":{},"status":"discard","description":"perf: run only the very first startup highlight immediately","timestamp":1773845636382,"segment":0}
{"run":11,"commit":"3aea0fd","metric":105.32,"metrics":{},"status":"keep","description":"perf: serialize startup highlight work with a lean promise chain","timestamp":1773846023678,"segment":0}
{"run":12,"commit":"3aea0fd","metric":124.86,"metrics":{},"status":"discard","description":"perf: run the promise-chain startup queue without an extra microtask","timestamp":1773846050923,"segment":0}
{"run":13,"commit":"afa7a74","metric":104.19,"metrics":{},"status":"keep","description":"perf: reuse per-appearance Pierre render options","timestamp":1773846124613,"segment":0}
{"run":14,"commit":"df441c5","metric":95.31,"metrics":{},"status":"keep","description":"perf: cache Pierre highlighter options per appearance and language","timestamp":1773846164659,"segment":0}
{"run":15,"commit":"df441c5","metric":99.72,"metrics":{},"status":"discard","description":"perf: cache the full shared highlighter options object","timestamp":1773846206209,"segment":0}
{"run":16,"commit":"df441c5","metric":97.31,"metrics":{},"status":"checks_failed","description":"perf: retry an in-flight highlighter cache on top of the lean queue","timestamp":1773846277697,"segment":0}
{"run":17,"commit":"df441c5","metric":99.83,"metrics":{},"status":"discard","description":"perf: retry an in-flight highlighter cache with the corrected option types","timestamp":1773846346617,"segment":0}
{"type":"config","name":"Optimize visible app startup syntax highlighting (3-run average)","metricName":"selected_highlight_ms","metricUnit":"ms","bestDirection":"lower"}
{"run":1,"commit":"687a7f7","metric":605.13,"metrics":{},"status":"keep","description":"benchmark: measure visible app startup syntax highlighting","timestamp":1773846484355,"segment":0}
{"run":2,"commit":"687a7f7","metric":611.56,"metrics":{},"status":"discard","description":"perf: start selected-file highlight loading during render setup","timestamp":1773846575263,"segment":0}
{"run":3,"commit":"c9483d7","metric":604.71,"metrics":{},"status":"keep","description":"perf: fast-path plain diff spans before highlighted HAST arrives","timestamp":1773846636860,"segment":0}
{"run":4,"commit":"1697f4a","metric":603.36,"metrics":{},"status":"keep","description":"perf: start syntax highlight loading in a layout effect","timestamp":1773846688546,"segment":0}
{"run":5,"commit":"1697f4a","metric":611.36,"metrics":{},"status":"discard","description":"perf: start syntax highlight loading only from the layout effect","timestamp":1773846781407,"segment":0}
{"run":6,"commit":"1697f4a","metric":609.83,"metrics":{},"status":"discard","description":"perf: reserve render-start highlight kickoff for the selected file only","timestamp":1773846867514,"segment":0}
{"run":7,"commit":"1697f4a","metric":612.27,"metrics":{},"status":"discard","description":"perf: add a cheaper common-case diff line normalization path","timestamp":1773846919777,"segment":0}
{"run":8,"commit":"1697f4a","metric":611.82,"metrics":{},"status":"discard","description":"perf: transition non-selected highlight state updates","timestamp":1773847114482,"segment":0}
{"run":9,"commit":"1697f4a","metric":603.59,"metrics":{},"status":"discard","description":"perf: memoize app startup derived data","timestamp":1773847248132,"segment":0}
{"run":10,"commit":"1697f4a","metric":610.13,"metrics":{},"status":"discard","description":"perf: skip redundant clear-state updates before the first highlight arrives","timestamp":1773847339041,"segment":0}
